{
  "$schema": "https://json-schema.org/draft/2020-12/schema",
  "$id": "model-card.schema.json",
  "title": "MIR ModelCard v1",
  "type": "object",
  "additionalProperties": false,
  "required": [
    "schema_version",
    "id",
    "display_name",
    "identity",
    "routing",
    "modalities",
    "limits",
    "task_scores",
    "evidence"
  ],
  "properties": {
    "schema_version": {
      "const": "model-card.v1"
    },
    "id": {
      "type": "string",
      "pattern": "^[a-z0-9][a-z0-9._-]*$"
    },
    "display_name": {
      "type": "string",
      "minLength": 1
    },
    "identity": {
      "type": "object",
      "additionalProperties": false,
      "required": ["provider", "family", "kind", "aliases", "evidence"],
      "properties": {
        "provider": {
          "type": "string"
        },
        "family": {
          "type": "string"
        },
        "kind": {
          "enum": [
            "language",
            "vision",
            "embedding",
            "image",
            "audio",
            "video",
            "service"
          ]
        },
        "aliases": {
          "type": "array",
          "items": {
            "type": "string"
          }
        },
        "evidence": {
          "type": "array",
          "minItems": 1,
          "items": {
            "$ref": "#/$defs/evidence"
          }
        }
      }
    },
    "routing": {
      "type": "object",
      "additionalProperties": false,
      "required": ["status", "automated_routing", "evidence"],
      "properties": {
        "status": {
          "enum": [
            "eligible",
            "manual_only",
            "probation",
            "phantom",
            "denied",
            "investigation_required",
            "listed_unexploited",
            "deprecated",
            "known_unmeasured"
          ]
        },
        "automated_routing": {
          "type": "boolean"
        },
        "evidence": {
          "type": "array",
          "minItems": 1,
          "items": {
            "$ref": "#/$defs/evidence"
          }
        }
      }
    },
    "modalities": {
      "type": "array",
      "items": {
        "type": "object",
        "additionalProperties": false,
        "required": ["id", "value", "evidence"],
        "properties": {
          "id": {
            "type": "string"
          },
          "value": {
            "enum": [true, false, null]
          },
          "evidence": {
            "type": "array",
            "minItems": 1,
            "items": {
              "$ref": "#/$defs/evidence"
            }
          }
        }
      }
    },
    "limits": {
      "type": "object",
      "additionalProperties": false,
      "required": ["context_tokens", "output_tokens"],
      "properties": {
        "context_tokens": {
          "type": "object",
          "additionalProperties": false,
          "required": ["value", "evidence"],
          "properties": {
            "value": {
              "type": ["integer", "null"],
              "minimum": 1
            },
            "evidence": {
              "type": "array",
              "minItems": 1,
              "items": {
                "$ref": "#/$defs/evidence"
              }
            }
          }
        },
        "output_tokens": {
          "type": "object",
          "additionalProperties": false,
          "required": ["value", "evidence"],
          "properties": {
            "value": {
              "type": ["integer", "null"],
              "minimum": 1
            },
            "evidence": {
              "type": "array",
              "minItems": 1,
              "items": {
                "$ref": "#/$defs/evidence"
              }
            }
          }
        }
      }
    },
    "constraints": {
      "type": "array",
      "items": {
        "type": "object",
        "additionalProperties": false,
        "required": ["id", "value", "evidence"],
        "properties": {
          "id": {
            "type": "string"
          },
          "value": {
            "type": ["string", "boolean", "null"]
          },
          "evidence": {
            "type": "array",
            "minItems": 1,
            "items": {
              "$ref": "#/$defs/evidence"
            }
          }
        }
      }
    },
    "task_scores": {
      "type": "array",
      "items": {
        "type": "object",
        "additionalProperties": false,
        "required": ["task_profile_id", "score", "sample_count", "evidence"],
        "properties": {
          "task_profile_id": {
            "type": "string"
          },
          "score": {
            "type": ["number", "null"],
            "minimum": 0,
            "maximum": 1
          },
          "benchmark_id": {
            "type": ["string", "null"]
          },
          "benchmark_version": {
            "type": ["string", "null"]
          },
          "sample_count": {
            "type": "integer",
            "minimum": 0
          },
          "evidence": {
            "type": "array",
            "minItems": 1,
            "items": {
              "$ref": "#/$defs/evidence"
            }
          }
        }
      }
    },
    "evidence": {
      "type": "array",
      "minItems": 1,
      "items": {
        "$ref": "#/$defs/evidence"
      }
    }
  },
  "$defs": {
    "evidence": {
      "type": "object",
      "additionalProperties": false,
      "required": ["level", "ref", "observed_at"],
      "properties": {
        "level": {
          "enum": [
            "declared",
            "probed",
            "benchmarked",
            "production",
            "unmeasured"
          ]
        },
        "ref": {
          "type": "string",
          "minLength": 1
        },
        "observed_at": {
          "type": "string",
          "pattern": "^\\d{4}-\\d{2}-\\d{2}"
        }
      }
    }
  }
}
