{
  "schema_version": "model-card.v1",
  "id": "gemini-3.5-flash",
  "display_name": "Gemini 3.5 Flash",
  "identity": {
    "provider": "google",
    "family": "gemini-3",
    "kind": "language",
    "aliases": [],
    "evidence": [
      {
        "level": "declared",
        "ref": "MODEL_ROSTER.md#Google",
        "observed_at": "2026-08-21"
      }
    ]
  },
  "routing": {
    "status": "eligible",
    "automated_routing": false,
    "evidence": [
      {
        "level": "declared",
        "ref": "MODEL_ROSTER.md#Google",
        "observed_at": "2026-08-21"
      }
    ]
  },
  "modalities": [
    {
      "id": "language",
      "value": true,
      "evidence": [
        {
          "level": "declared",
          "ref": "MODEL_ROSTER.md#Google",
          "observed_at": "2026-08-21"
        }
      ]
    },
    {
      "id": "reasoning_control",
      "value": true,
      "evidence": [
        {
          "level": "declared",
          "ref": "MODEL_ROSTER.md#Google",
          "observed_at": "2026-08-21"
        }
      ]
    }
  ],
  "limits": {
    "context_tokens": {
      "value": 1048576,
      "evidence": [
        {
          "level": "declared",
          "ref": "Google Gemini 3.5 Flash model page | https://ai.google.dev/gemini-api/docs/models/gemini-3.5-flash",
          "observed_at": "2026-08-21"
        }
      ]
    },
    "output_tokens": {
      "value": 65536,
      "evidence": [
        {
          "level": "declared",
          "ref": "Google Gemini 3.5 Flash model page | https://ai.google.dev/gemini-api/docs/models/gemini-3.5-flash",
          "observed_at": "2026-08-21"
        }
      ]
    }
  },
  "constraints": [
    {
      "id": "candidate_only_harness",
      "value": true,
      "evidence": [
        {
          "level": "declared",
          "ref": "MODEL_ROSTER.md#Google",
          "observed_at": "2026-08-21"
        }
      ]
    },
    {
      "id": "declared_capability_profile",
      "value": "Text, image, video, audio, and PDF input with text output; supports caching, code execution, computer use preview, file search, function calling, Maps/Search grounding, structured output, thinking, and URL context; intended for subagent deployment, multistep work, long-horizon tasks, and rapid coding loops.",
      "evidence": [
        {
          "level": "declared",
          "ref": "Google Gemini 3.5 Flash model page and Gemini 3.5 announcement | https://ai.google.dev/gemini-api/docs/models/gemini-3.5-flash | https://blog.google/innovation-and-ai/models-and-research/gemini-models/gemini-3-5/",
          "observed_at": "2026-08-21"
        }
      ]
    }
  ],
  "task_scores": [],
  "evidence": [
    {
      "level": "declared",
      "ref": "MODEL_ROSTER.md#Google",
      "observed_at": "2026-08-21"
    },
    {
      "level": "declared",
      "ref": "Google Gemini 3.5 Flash model page | https://ai.google.dev/gemini-api/docs/models/gemini-3.5-flash",
      "observed_at": "2026-08-21"
    }
  ]
}
