{
  "schema_version": "model-card.v1",
  "id": "happyhorse-1.1-r2v",
  "display_name": "HappyHorse 1.1 R2V",
  "identity": {
    "provider": "alibaba",
    "family": "happyhorse",
    "kind": "video",
    "aliases": [],
    "evidence": [
      {
        "level": "declared",
        "ref": "FLEET_TOPOLOGY.json#accounts.alibaba.slots.TP1.console_verified_2026_08_14.unexploited_capabilities",
        "observed_at": "2026-08-14"
      }
    ]
  },
  "routing": {
    "status": "listed_unexploited",
    "automated_routing": false,
    "evidence": [
      {
        "level": "declared",
        "ref": "FLEET_TOPOLOGY.json#accounts.alibaba.slots.TP1.console_verified_2026_08_14.unexploited_capabilities",
        "observed_at": "2026-08-14"
      }
    ]
  },
  "modalities": [
    {
      "id": "video_generation",
      "value": true,
      "evidence": [
        {
          "level": "declared",
          "ref": "FLEET_TOPOLOGY.json#accounts.alibaba.slots.TP1.console_verified_2026_08_14.unexploited_capabilities",
          "observed_at": "2026-08-14"
        }
      ]
    }
  ],
  "limits": {
    "context_tokens": {
      "value": null,
      "evidence": [
        {
          "level": "unmeasured",
          "ref": "FLEET_TOPOLOGY.json#accounts.alibaba.slots.TP1.console_verified_2026_08_14.unexploited_capabilities",
          "observed_at": "2026-08-14"
        }
      ]
    },
    "output_tokens": {
      "value": null,
      "evidence": [
        {
          "level": "unmeasured",
          "ref": "FLEET_TOPOLOGY.json#accounts.alibaba.slots.TP1.console_verified_2026_08_14.unexploited_capabilities",
          "observed_at": "2026-08-14"
        }
      ]
    }
  },
  "constraints": [
    {
      "id": "declared_video_output",
      "value": "Reference-image-to-video with audio; 480P, 720P, or 1080P; 3 to 15 seconds; 24 fps MP4 output.",
      "evidence": [
        {
          "level": "declared",
          "ref": "https://help.aliyun.com/en/model-studio/video-generate-edit-model | Video generation and editing | accessed 2026-08-21 | Exact claim: happyhorse-1.1-r2v documents reference-image-to-video and these output properties.",
          "observed_at": "2026-08-21"
        }
      ]
    },
    {
      "id": "wired_to_role_chain",
      "value": false,
      "evidence": [
        {
          "level": "declared",
          "ref": "FLEET_TOPOLOGY.json#accounts.alibaba.slots.TP1.console_verified_2026_08_14.unexploited_capabilities",
          "observed_at": "2026-08-14"
        }
      ]
    }
  ],
  "task_scores": [],
  "evidence": [
    {
      "level": "declared",
      "ref": "FLEET_TOPOLOGY.json#accounts.alibaba.slots.TP1.console_verified_2026_08_14.unexploited_capabilities",
      "observed_at": "2026-08-14"
    },
    {
      "level": "declared",
      "ref": "https://help.aliyun.com/en/model-studio/video-generate-edit-model | Video generation and editing | accessed 2026-08-21 | Exact claim: happyhorse-1.1-r2v is reference-image-to-video with audio and 480P/720P/1080P, 3-15 second, 24 fps MP4 output.",
      "observed_at": "2026-08-21"
    }
  ]
}
