{
  "schema_version": "model-card.v1",
  "id": "qwen3-coder",
  "display_name": "qwen3-coder",
  "identity": {
    "provider": "alibaba",
    "family": "qwen3",
    "kind": "language",
    "aliases": [],
    "evidence": [
      {
        "level": "probed",
        "ref": "FLEET_TOPOLOGY.json#accounts.alibaba.slots.TP1.models_measured_2026_08_21",
        "observed_at": "2026-08-21"
      }
    ]
  },
  "routing": {
    "status": "investigation_required",
    "automated_routing": false,
    "evidence": [
      {
        "level": "probed",
        "ref": "FLEET_TOPOLOGY.json#accounts.alibaba.slots.TP1.models_measured_2026_08_21",
        "observed_at": "2026-08-21"
      }
    ]
  },
  "modalities": [
    {
      "id": "language",
      "value": true,
      "evidence": [
        {
          "level": "probed",
          "ref": "FLEET_TOPOLOGY.json#accounts.alibaba.slots.TP1.models_measured_2026_08_21",
          "observed_at": "2026-08-21"
        }
      ]
    },
    {
      "id": "coding",
      "value": true,
      "evidence": [
        {
          "level": "probed",
          "ref": "FLEET_TOPOLOGY.json#accounts.alibaba.slots.TP1.models_measured_2026_08_21",
          "observed_at": "2026-08-21"
        }
      ]
    }
  ],
  "limits": {
    "context_tokens": {
      "value": null,
      "evidence": [
        {
          "level": "unmeasured",
          "ref": "FLEET_TOPOLOGY.json#accounts.alibaba.slots.TP1.models_measured_2026_08_21",
          "observed_at": "2026-08-21"
        }
      ]
    },
    "output_tokens": {
      "value": null,
      "evidence": [
        {
          "level": "unmeasured",
          "ref": "FLEET_TOPOLOGY.json#accounts.alibaba.slots.TP1.models_measured_2026_08_21",
          "observed_at": "2026-08-21"
        }
      ]
    }
  },
  "constraints": [
    {
      "id": "live_probe_result",
      "value": "PONG on Air-M5, Pro, and Mini-Pro2",
      "evidence": [
        {
          "level": "probed",
          "ref": "FLEET_TOPOLOGY.json#accounts.alibaba.slots.TP1.models_measured_2026_08_21",
          "observed_at": "2026-08-21"
        }
      ]
    },
    {
      "id": "billing_plan_eligibility",
      "value": "unresolved",
      "evidence": [
        {
          "level": "probed",
          "ref": "FLEET_TOPOLOGY.json#accounts.alibaba.slots.TP1.models_measured_2026_08_21",
          "observed_at": "2026-08-21"
        }
      ]
    }
  ],
  "task_scores": [],
  "evidence": [
    {
      "level": "probed",
      "ref": "FLEET_TOPOLOGY.json#accounts.alibaba.slots.TP1.models_measured_2026_08_21",
      "observed_at": "2026-08-21"
    }
  ]
}
